{
  "$schema": "https://json-schema.org/draft/2020-12/schema",
  "$id": "https://raw.githubusercontent.com/stolau/PixelPerfectSnapshot/main/docs/snapshot.schema.json",
  "title": "PixelPerfectSnapshot snapshot (format v0.4, formatVersion 0)",
  "type": "object",
  "required": ["formatVersion", "name", "viewport", "html", "stylesheets"],
  "additionalProperties": false,
  "dependentRequired": {
    "when": ["spec"]
  },
  "properties": {
    "formatVersion": {
      "const": 0
    },
    "name": {
      "type": "string",
      "minLength": 1,
      "maxLength": 200,
      "pattern": "^[^/]+$"
    },
    "category": {
      "type": "string",
      "minLength": 1,
      "maxLength": 200,
      "pattern": "^[^/]+$"
    },
    "spec": {
      "type": "string",
      "minLength": 1,
      "maxLength": 200,
      "pattern": "^[^/]+$"
    },
    "when": {
      "type": "string",
      "minLength": 1,
      "maxLength": 500
    },
    "viewport": {
      "type": "object",
      "required": ["width", "height"],
      "additionalProperties": false,
      "properties": {
        "width": { "type": "integer", "minimum": 1 },
        "height": { "type": "integer", "minimum": 1 }
      }
    },
    "html": {
      "type": "string",
      "minLength": 1
    },
    "stylesheets": {
      "type": "array",
      "items": {
        "type": "object",
        "required": ["href", "content"],
        "additionalProperties": false,
        "properties": {
          "href": { "type": "string" },
          "content": { "type": "string" }
        }
      }
    }
  }
}
